{
  "object": "language-pack",
  "schema_version": "0.1.0",
  "id": "open-lens/en",
  "name": "Open Lens English",
  "version": "0.2.0",
  "updated": "2026-07-07",
  "license": "CC-BY-SA-4.0",
  "languages": [
    "en"
  ],
  "techniques": [
    {
      "id": "OL.HEDGE",
      "key": "hedge",
      "name": "Hedging",
      "family": "hedging",
      "status": "live",
      "what": "marks wording that lowers the sentence's expressed level of commitment",
      "affordance": "can preserve uncertainty, politeness, precision, or room for later qualification",
      "mechanism": "weakens the force of an assertion while keeping its content on the table — deniability without retraction",
      "benign_reading": "Hedges very often express genuine uncertainty — epistemic honesty, not evasion (Lakoff 1973). The tell is hedging where a commitment was asked for and available.",
      "ledger_line": "<b>{n}</b> hedge cue{s} — expressed commitment is grammatically lowered",
      "output_phrasing": "this span contains wording that lowers the sentence's expressed level of commitment",
      "naming_events": [
        {
          "term": "aporia / dubitatio",
          "lang": "grc/la",
          "source": "classical figure catalogs; Peacham, The Garden of Eloquence (1577) — staged doubt",
          "when": "antiquity–1577"
        },
        {
          "term": "hedges",
          "lang": "en",
          "source": "George Lakoff, 'Hedges: A Study in Meaning Criteria and the Logic of Fuzzy Concepts', Journal of Philosophical Logic 2",
          "when": "1973"
        },
        {
          "term": "hedge/weasel detection",
          "lang": "en",
          "source": "CoNLL-2010 Shared Task, 'Learning to Detect Hedges and their Scope'",
          "when": "2010"
        }
      ],
      "universality": 3,
      "crosswalk": {
        "semeval2023": null,
        "note": "no SemEval-2023 equivalent — framework-native family; the standard lexicon (LIWC certainty/tentativeness) is proprietary, so the open pack is built fresh"
      },
      "realizations": {
        "en": {
          "match": "surface",
          "patterns": [
            "sort of",
            "kind of",
            "kinda",
            "i think",
            "i guess",
            "i believe",
            "i feel like",
            "i suppose",
            "probably",
            "maybe",
            "perhaps",
            "more or less",
            "to be honest",
            "to be fair",
            "in my opinion",
            "i'm not sure",
            "as far as i know",
            "to the best of my knowledge",
            "somewhat",
            "fairly",
            "pretty much",
            "seemingly",
            "apparently",
            "allegedly",
            "reportedly",
            "from what i understand",
            "if i'm honest",
            "i would say",
            "it seems",
            "arguably",
            "relatively"
          ],
          "provenance": "seed — extracted verbatim from the v2 reader (2026-07-06); specimen backfill tracked in CONTRIBUTING"
        }
      },
      "specimens": [
        {
          "quote": "I believe nicotine is not addictive, yes.",
          "speaker": "William Campbell, President and CEO, Philip Morris USA",
          "date": "1994-04-14",
          "source": "https://web.archive.org/web/20260416104407/https://senate.ucsf.edu/tobacco-ceo-statement-to-congress",
          "note": "Under oath at the Waxman hearing, the 'I believe' wrapper converts a factual claim contradicted by Philip Morris's own suppressed research into an unfalsifiable statement of personal belief — perjury insulation; all s…"
        },
        {
          "quote": "I think the environmental impact of this disaster is likely to be very, very modest.",
          "speaker": "Tony Hayward, CEO, BP (Sky News interview during the Deepwater Horizon spill)",
          "date": "2010-05-18",
          "source": "https://www.bbc.co.uk/news/10360084",
          "note": "'I think' plus 'likely to be' doubly lowers commitment on a minimizing forecast BP needed the public to accept mid-crisis, keeping the claim retractable — as it had to be when the spill became the largest in US history."
        },
        {
          "quote": "I'm not sure of the exact date but I probably heard about Fast and Furious for the first time over the last few weeks.",
          "speaker": "Eric Holder, US Attorney General, testimony to the House Judiciary Committee",
          "date": "2011-05-03",
          "source": "https://www.govinfo.gov/content/pkg/CHRG-112hhrg66154/html/CHRG-112hhrg66154.htm",
          "note": "The stacked hedges keep the date claim walk-backable: when memos surfaced showing his office was briefed in July 2010, DOJ recharacterized rather than retracted the answer — exactly the deniability-without-retraction …"
        },
        {
          "quote": "Senator — I — I want to make sure I get this accurate, so it would probably be better to have my team follow up afterwards.",
          "speaker": "Mark Zuckerberg, CEO, Facebook, Senate Judiciary/Commerce joint hearing (answering Sen. Wicker on tracking logged-off users)",
          "date": "2018-04-10",
          "source": "https://en.wikisource.org/wiki/Zuckerberg_Senate_Transcript_2018",
          "note": "A yes/no confirmation was asked for and available (Facebook did track logged-out browsing via cookies and pixels); 'would probably be better to have my team follow up' hedges the deferral itself, so no on-record commi…"
        },
        {
          "quote": "Our intelligence agencies continue to assess all information, but it could very well be that the Crown Prince had knowledge of this tragic event – maybe he did and maybe he didn't!",
          "speaker": "President Donald J. Trump, official White House statement 'Standing with Saudi Arabia' (on the Khashoggi murder)",
          "date": "2018-11-20",
          "source": "https://trumpwhitehouse.archives.gov/briefings-statements/statement-president-donald-j-trump-standing-saudi-arabia/"
        }
      ],
      "counter_specimens": [],
      "citations": [
        "Lakoff, G. (1973). Hedges. Journal of Philosophical Logic 2, 458–508.",
        "Farkas et al. (2010). The CoNLL-2010 Shared Task. (BioScope; Wikipedia weasel corpus.)"
      ],
      "honest_twins": [
        {
          "text": "I think the standup moved to 3pm, but check the calendar invite before you head over.",
          "note": "Same 'i think' construction, but here it marks genuine uncertainty and the speaker immediately points the listener to a way to verify — epistemic honesty (the benign reading), not deniability: no commitment was asked for that the speaker is dodging.",
          "attribution": "constructed example"
        },
        {
          "text": "To the best of my knowledge the outage never touched the payments tier — but I can only see the app-server logs, so ask infra to confirm.",
          "note": "'To the best of my knowledge' honestly scopes the claim to the evidence the speaker actually has and names the limit of that evidence; the hedge invites checking rather than pre-building a walk-back.",
          "attribution": "constructed example"
        }
      ]
    },
    {
      "id": "OL.DEFLECT",
      "key": "deflect",
      "name": "Deflection",
      "family": "deflection",
      "status": "live",
      "what": "marks wording often used to manage a response or shift its topic",
      "affordance": "can redirect attention or manage a transition while retaining the form of a response",
      "mechanism": "violates Grice's maxim of Relation while performing cooperation — the question is left standing, unanswered",
      "benign_reading": "Changing the subject can be tact, care, or discretion. The tell is a direct question steered around rather than declined openly.",
      "ledger_line": "<b>{n}</b> response-management or topic-shift cue{s} matched",
      "output_phrasing": "this span matches an English response-management or topic-shift cue",
      "naming_events": [
        {
          "term": "ignoratio elenchi",
          "lang": "grc",
          "source": "Aristotle, Sophistical Refutations (one of the original 13 fallacies)",
          "when": "c. 350 BCE"
        },
        {
          "term": "chala (quibble, 3 types)",
          "lang": "sa",
          "source": "Nyāyasūtra 1.2.10–14 — deflection by misconstrual",
          "when": "c. 150 CE (core redaction)"
        },
        {
          "term": "apoplanesis",
          "lang": "grc/en",
          "source": "Peacham, The Garden of Eloquence — evading by digression",
          "when": "1577"
        },
        {
          "term": "whataboutism",
          "lang": "en/ru",
          "source": "Soviet-institutionalized tu quoque ('And you are lynching Negroes'); popularized as a term by The Economist",
          "when": "20th c."
        }
      ],
      "universality": 3,
      "crosswalk": {
        "semeval2023": "Distraction (family): Red Herring; Whataboutism",
        "ptc2019": "Red Herring; Whataboutism"
      },
      "realizations": {
        "en": {
          "match": "surface",
          "patterns": [
            "let me be clear",
            "let me be very clear",
            "what i will say",
            "the real question",
            "the real issue",
            "the bigger picture",
            "let's focus",
            "let's not forget",
            "moving forward",
            "going forward",
            "at this time",
            "at the end of the day",
            "with respect",
            "with all due respect",
            "that's a great question",
            "that's a good question",
            "i hear you",
            "i don't recall",
            "i do not recall",
            "i don't remember",
            "no comment",
            "we'll see",
            "it is what it is",
            "reaching out",